id,slug,name,category,tagline,tags,neighborhood,address,city,country,lat,lng,maps_url,website,phone,url,logo_url,hero_url,image_credit,image_source_url,hours_raw,description,about_short,about_long,price_range,pricing,amenities,cuisines,meals,rating_overall,sub_food_quality,sub_service,sub_ambience,sub_value,sub_accessibility,review_count,review_source,review_insight,last_updated,services,coverage_area,truck_sizes,packing_materials,storage_available,insurance_offered,free_quote_url,quote_url,booking_url,tracking_url,brochure_url,packing,unpacking,storage,international_moving,local_moving,office_moving,residential_moving,vehicle_shipping,pet_relocation,insurance,customs_clearance,heavy_lift,boxes_supplies,approx_price_min,approx_price_max
ChIJQ2FES4H5kT4RhEmGkYMiRmY,iss-relocations,ISS Relocations,Moving & Storage,,moving;relocation;storage;packers,,"45, Hatat Complex A, Ground Floor Building A, مسقط 112, Oman",Muscat,Oman,23.591932,58.523943,https://www.google.com/maps/place/?q=place_id:ChIJQ2FES4H5kT4RhEmGkYMiRmY,https://www.iss-relocations.com/,+968 24 567707,https://www.iss-relocations.com/,https://www.google.com/s2/favicons?domain=www.iss-relocations.com&sz=128,https://iss-relocations.com/wp-content/uploads/2025/05/Trusted-Experts-in-Residential-Office-International-Relocations-ISS-Relocations.jpg,,,,,"Need moving services in UAE? ISS Relocations provides expert house, office, and international relocations with end-to-end support. Get a free quote today!","Need moving services in UAE? ISS Relocations provides expert house, office, and international relocations with end-to-end support. Get a free quote today! Relocating your home, office, or even your entire life to a new country? At ISS Relocations , we understand that moving is more than just transporting boxes — it’s about ensuring a seamless journey to your next chapter. Whether you’re shifting across the street in Dubai or moving overseas from Abu Dhabi, our professional moving services in UAE are designed to take the stress out of your relocation. Local or international. Residential or…",,,packing;storage;international moving;local moving;office moving;residential moving;pet relocation;insurance;customs clearance;boxes & supplies,,,5.00,,,,,,1,Google,,2025-10-04,,,,,,,,https://iss-relocations.com/request-a-quote/,https://iss-relocations.com/e-brochure-iss-relocation/,https://iss-relocations.com/e-brochure-iss-relocation/,https://iss-relocations.com/e-brochure-iss-relocation/,Yes,,Yes,Yes,Yes,Yes,Yes,,Yes,Yes,Yes,,Yes,,
ChIJV7F9lR75kT4RVqGB-lpRqlA,iss-relocations,ISS Relocations,Moving & Storage,,moving;relocation;storage;packers,,"Warehouse 08, Vitality Logistics Warehouse Compound, 2985 Way, مسقط 112, Oman",Muscat,Oman,23.602833,58.543503,https://www.google.com/maps/place/?q=place_id:ChIJV7F9lR75kT4RVqGB-lpRqlA,https://www.iss-relocations.com/,+968 24 567707,https://www.iss-relocations.com/,https://www.google.com/s2/favicons?domain=www.iss-relocations.com&sz=128,https://iss-relocations.com/wp-content/uploads/2025/05/Trusted-Experts-in-Residential-Office-International-Relocations-ISS-Relocations.jpg,,,,,"Need moving services in UAE? ISS Relocations provides expert house, office, and international relocations with end-to-end support. Get a free quote today!","Need moving services in UAE? ISS Relocations provides expert house, office, and international relocations with end-to-end support. Get a free quote today! Relocating your home, office, or even your entire life to a new country? At ISS Relocations , we understand that moving is more than just transporting boxes — it’s about ensuring a seamless journey to your next chapter. Whether you’re shifting across the street in Dubai or moving overseas from Abu Dhabi, our professional moving services in UAE are designed to take the stress out of your relocation. Local or international. Residential or…",,,packing;storage;international moving;local moving;office moving;residential moving;pet relocation;insurance;customs clearance;boxes & supplies,,,4.70,,,,,,47,Google,,2025-10-04,,,,,,,,https://iss-relocations.com/request-a-quote/,https://iss-relocations.com/e-brochure-iss-relocation/,https://iss-relocations.com/e-brochure-iss-relocation/,https://iss-relocations.com/e-brochure-iss-relocation/,Yes,,Yes,Yes,Yes,Yes,Yes,,Yes,Yes,Yes,,Yes,,
ChIJQ6Y6G1FpXz4RMVMf4W3KtRc,idea-star-packing-materials-company-llc,Idea Star Packing Materials Company LLC,Moving & Storage,,moving;relocation;storage;packers,,Post Box number: 115299 - 26th St - Al Quoz - Al Quoz Industrial Area 4 - Dubai - United Arab Emirates,Muscat,Oman,25.110904,55.233090,https://www.google.com/maps/place/?q=place_id:ChIJQ6Y6G1FpXz4RMVMf4W3KtRc,https://www.ideastarpackingmaterials.com/,+971 55 972 5112,https://www.ideastarpackingmaterials.com/,https://www.google.com/s2/favicons?domain=www.ideastarpackingmaterials.com&sz=128,https://www.ideastarpackingmaterials.com/uploads/product/small/75.jpg,,,,,"Idea Star is the best packing materials company in Dubai, We are the best in providing perfect packing materials in Dubai and packaging materials manufacturers & Suppliers in Dubai, UAE","Idea Star is the best packing materials company in Dubai, We are the best in providing perfect packing materials in Dubai and packaging materials manufacturers & Suppliers in Dubai, UAE With more than 30 years of experience as a packaging materials supplier and manufacturer in Dubai, United Arab Emirates",,,packing;storage;boxes & supplies,,,4.70,,,,,,122,Google,,2025-10-04,,,,,,,,,,,,Yes,,Yes,,,,,,,,,,Yes,,
ChIJTZsZH-ddXz4R0pPFMLuiLFY,international-moving-company-movers-global,International Moving Company - Movers Global,Moving & Storage,,moving;relocation;storage;packers,,"Office No.SF-01, Second Floor, Galadhari Building - Al Ittihad Rd - أبو هيل - دبي - United Arab Emirates",Muscat,Oman,25.274705,55.347998,https://www.google.com/maps/place/?q=place_id:ChIJTZsZH-ddXz4R0pPFMLuiLFY,https://www.movers-global.com/,+971 4 287 9900,https://www.movers-global.com/,https://www.google.com/s2/favicons?domain=www.movers-global.com&sz=128,https://www.movers-global.com/wp-content/uploads/2019/11/happy-children-helping-parents-unpack-boxes-moving-day_1163-3940.jpg,,,,,Movers global - an international moving company in Dubai - helps you to deal with the entire job of relocation in a seamless and straightforward manner.,"Movers global - an international moving company in Dubai - helps you to deal with the entire job of relocation in a seamless and straightforward manner. Are you planning to relocate to another country or move some of your belongings? Door-to-Door, 2CBM or upto 12CBM, 20/40FT Container. Are you looking for the best International Moving companies in Dubai? Ever since 2003, Movers Global has the honor to be UAE’s premium Moving Expert.",,,packing;unpacking;storage;international moving;local moving;office moving;vehicle shipping;pet relocation;insurance;heavy lift,,,5.00,,,,,,10,Google,,2025-10-04,,,,,,,,https://movers-global.com/get-a-quote/,,https://movers-global.com/track-your-shipment/,https://movers-global.com/,Yes,Yes,Yes,Yes,Yes,Yes,,Yes,Yes,Yes,,Yes,,,
ChIJY_ZP9qr5kT4RYCMdJ5TG6Mc,mover-of-oman,Mover of Oman,Moving & Storage,,moving;relocation;storage;packers,,"4376 Ruwi OM, مسقط 112, Oman",Muscat,Oman,23.597531,58.540170,https://www.google.com/maps/place/?q=place_id:ChIJY_ZP9qr5kT4RYCMdJ5TG6Mc,http://moverofoman.com/,+968 9695 9473,http://moverofoman.com/,https://www.google.com/s2/favicons?domain=moverofoman.com&sz=128,https://www.omanobserver.om/omanobserver/uploads/images/2025/04/02/2969730.jpeg,,,,,,,,,,,,5.00,,,,,,2,Google,,2025-10-04,,,,,,,,,,,,,,,,,,,,,,,,,,
ChIJbVWzP0FZXz4RexnxgorCcf0,movers-company,Movers company,Moving & Storage,,moving;relocation;storage;packers,,Ithad street - Al Wasl - Dubai - United Arab Emirates,Muscat,Oman,25.200137,55.257409,https://www.google.com/maps/place/?q=place_id:ChIJbVWzP0FZXz4RexnxgorCcf0,https://mizanmovers.com/,+971 50 212 7269,https://mizanmovers.com/,https://www.google.com/s2/favicons?domain=mizanmovers.com&sz=128,https://mizanmovers.com/public/uploads/team-member-1.jpg,,,,,,"Don’t spend your precious time on moving your house. Shift your responsibilities to us. UAE’s largest and Top Rated Moving Service, handle your Home Relocation, while you enjoy peace of mind.",,,packing;storage;international moving;office moving,,,4.00,,,,,,1,Google,,2025-10-04,,,,,,,,https://mizanmovers.com/pricing,,,,Yes,,Yes,Yes,,Yes,,,,,,,,,
ChIJme7008CqHYkRM1Q1TZJ71_k,muscat-mover-and-packer,Muscat Mover and Packer,Moving & Storage,,moving;relocation;storage;packers,,"3961 Way, Muscat 131, Oman",Muscat,Oman,23.589040,58.544196,https://www.google.com/maps/place/?q=place_id:ChIJme7008CqHYkRM1Q1TZJ71_k,https://www.muscatmoverandpacker.com/,+968 9478 7813,https://www.muscatmoverandpacker.com/,https://www.google.com/s2/favicons?domain=www.muscatmoverandpacker.com&sz=128,https://www.omanobserver.om/omanobserver/uploads/images/2024/06/25/2701550.jpg,,,,,,,,,,,,5.00,,,,,,9,Google,,2025-10-04,,,,,,,,,,,,,,,,,,,,,,,,,,
ChIJYWYEyUr5kT4RBwlkEOEUjs0,muscat-movers-packers,Muscat Movers & Packers,Moving & Storage,,moving;relocation;storage;packers,,"Ruwi High St, Muscat 112, Oman",Muscat,Oman,23.590060,58.547062,https://www.google.com/maps/place/?q=place_id:ChIJYWYEyUr5kT4RBwlkEOEUjs0,https://www.google.com/maps/place/?q=place_id:ChIJYWYEyUr5kT4RBwlkEOEUjs0,+968 7803 8755,https://www.google.com/maps/place/?q=place_id:ChIJYWYEyUr5kT4RBwlkEOEUjs0,https://www.google.com/s2/favicons?domain=www.google.com&sz=128,https://lh3.googleusercontent.com/p/AF1QipPDryxsBZWWWEA8Qklw-kIzDC0ftdjfeoPBfjOW=w900-h900-p-k-no,,,,,★★★★★ · Mover,★★★★★ · Mover,,,,,,5.00,,,,,,10,Google,,2025-10-04,,,,,,,,,,,,,,,,,,,,,,,,,,
ChIJnUV2g1QpRAIR7taofj_26Qw,muscat-movers-packers,Muscat Movers & Packers,Moving & Storage,,moving;relocation;storage;packers,,"HGQV+8JM Near by Arab & India Spices, Ruwi St, Muscat 112, Oman",Muscat,Oman,23.613321,58.543317,https://www.google.com/maps/place/?q=place_id:ChIJnUV2g1QpRAIR7taofj_26Qw,http://muscatmoverspackers.com/,+968 9899 0141,http://muscatmoverspackers.com/,https://www.google.com/s2/favicons?domain=muscatmoverspackers.com&sz=128,https://muscatmoverspackers.com/wp-content/uploads/2025/07/portrait-of-happy-woman-with-curly-hair-at-park-1024x1024.jpg,,,,,,"At Muscat Movers & Packers Services, we are proud to be a trusted moving company in Oman, offering top-quality relocation solutions tailored to meet your needs. With years of expertise and a highly skilled team, we ensure your move is smooth, stress-free, and professionally managed.",,,packing;storage;international moving;office moving;residential moving,,,4.70,,,,,,21,Google,,2025-10-04,,,,,,,,https://muscatmoverspackers.com/,,,,Yes,,Yes,Yes,,Yes,Yes,,,,,,,,
ChIJM5-Zren_kT4R_wjC0Ml87VQ,muscat-packaging-movers-llc,Muscat Packaging & Movers LLC,Moving & Storage,,moving;relocation;storage;packers,,"Way 9326 Block no 293 Misfah as safil, Misfah As Safil 112, Oman",Muscat,Oman,23.468768,58.265215,https://www.google.com/maps/place/?q=place_id:ChIJM5-Zren_kT4R_wjC0Ml87VQ,http://www.mpm-movers.com/,+968 9820 1154,http://www.mpm-movers.com/,https://www.google.com/s2/favicons?domain=www.mpm-movers.com&sz=128,https://mpm-movers.com/wp-content/uploads/2024/01/2-2-150x150.png,,,,,Get a Free Quote Please enable JavaScript in your browser to complete this form.Please enable JavaScript in your browser to,"Get a Free Quote Please enable JavaScript in your browser to complete this form.Please enable JavaScript in your browser to Way 9326 Block no 293 Misfah as safil, 112, Muscat, Sultanate of Oman",,,packing;unpacking;storage;international moving;local moving;office moving,,,4.60,,,,,,32,Google,,2025-10-04,,,,,,,,,,,,Yes,Yes,Yes,Yes,Yes,Yes,,,,,,,,,
ChIJv6_PmDX5kT4R-5J0b49yPWc,muscat-pro-services,Muscat Pro Services,Moving & Storage,,moving;relocation;storage;packers,,"Summer sand hotel wadi kabir ruwi, مسقط 112, Oman",Muscat,Oman,23.600774,58.544783,https://www.google.com/maps/place/?q=place_id:ChIJv6_PmDX5kT4R-5J0b49yPWc,https://www.muscatproservices.com/,+968 9673 2626,https://www.muscatproservices.com/,https://www.google.com/s2/favicons?domain=www.muscatproservices.com&sz=128,https://www.muscatproservices.com/wp-content/uploads/2025/08/2.jpg,,,,,"Muscat Pro Services is your go-to moving and logistics company in Oman. From local to international relocations, warehousing, and transport.","Muscat Pro Services is your go-to moving and logistics company in Oman. From local to international relocations, warehousing, and transport. Your trusted partner for local, long-distance, and international relocation. From careful packing to secure delivery, we handle every step with care — so you can move stress-free.",,,packing;unpacking;storage;international moving;office moving;customs clearance,,,5.00,,,,,,21,Google,,2025-10-04,,,,,,,,https://www.muscatproservices.com/contact/,,,,Yes,Yes,Yes,Yes,,Yes,,,,,Yes,,,,
ChIJqV1vV_TJwCAR0mxxYzOoJDc,muscat-professional-movers,Muscat Professional Movers,Moving & Storage,,moving;relocation;storage;packers,,"Way no 3502, Al Khuwair St, Muscat 129, Oman",Muscat,Oman,23.597076,58.425150,https://www.google.com/maps/place/?q=place_id:ChIJqV1vV_TJwCAR0mxxYzOoJDc,https://muscatprofessionalmovers.com/,+968 9458 7860,https://muscatprofessionalmovers.com/,https://www.google.com/s2/favicons?domain=muscatprofessionalmovers.com&sz=128,https://muscatprofessionalmovers.com/wp-content/uploads/2023/12/dollar-money-free-wallpaper-4492709.jpg,,,,,,"Muscat Professional Movers is a relocation company based in the Muscat that provides a range of services related to packing, moving, and storage. They specialize in both residential and commercial moves, and have experience with local moves.",,,packing;unpacking;storage;international moving;local moving;residential moving,,,4.80,,,,,,71,Google,,2025-10-04,,,,,,,,,,,,Yes,Yes,Yes,Yes,Yes,,Yes,,,,,,,,
ChIJM70aWAz_kT4RgeBVIr8iooo,muscat-best-movers,Muscat best Movers,Moving & Storage,,moving;relocation;storage;packers,,"Near Al Khuwair Market, Muscat 133, Oman",Muscat,Oman,23.591806,58.429055,https://www.google.com/maps/place/?q=place_id:ChIJM70aWAz_kT4RgeBVIr8iooo,https://muscatbestmovers.com/,+968 9746 3197,https://muscatbestmovers.com/,https://www.google.com/s2/favicons?domain=muscatbestmovers.com&sz=128,https://muscatbestmovers.com/wp-content/uploads/2025/08/WhatsApp_Image_2025-08-18_at_2.58.28_PM-removebg-preview.png,,,,,,"Looking for trusted movers and packers in Muscat? We provide complete relocation services including house shifting, villa moving, apartment relocation, office shifting, furniture moving, packing & unpacking, storage solutions, truck rental, and Muscat to Dubai moving services.",,,packing;unpacking;storage;international moving;local moving;office moving;residential moving;boxes & supplies,,,4.70,,,,,,92,Google,,2025-10-04,,,,,,,,,,,,Yes,Yes,Yes,Yes,Yes,Yes,Yes,,,,,,Yes,,
ChIJ0agF0wH9jT4Rv_AyP-L61M0,muscat-house-shifting,Muscat house shifting,Moving & Storage,,moving;relocation;storage;packers,,"12, Muscat, Oman",Muscat,Oman,23.628083,58.234137,https://www.google.com/maps/place/?q=place_id:ChIJ0agF0wH9jT4Rv_AyP-L61M0,https://www.google.com/maps/place/?q=place_id:ChIJ0agF0wH9jT4Rv_AyP-L61M0,+968 9528 8591,https://www.google.com/maps/place/?q=place_id:ChIJ0agF0wH9jT4Rv_AyP-L61M0,https://www.google.com/s2/favicons?domain=www.google.com&sz=128,https://streetviewpixels-pa.googleapis.com/v1/thumbnail?panoid=CEp2xrFN7gsyjcizhMUrRg&cb_client=search.gws-prod.gps&w=900&h=900&yaw=114.70976&pitch=0&thumbfov=100,,,,,★★★★★ · Mover,★★★★★ · Mover,,,,,,5.00,,,,,,2,Google,,2025-10-04,,,,,,,,,,,,,,,,,,,,,,,,,,
ChIJeeoDIQD5kT4R4X4uH5l9hQs,muscatmovers13,Muscatmovers13,Moving & Storage,,moving;relocation;storage;packers,,"Ruwi Street, 4117 way 3953, suit 112, Oman",Muscat,Oman,23.601562,58.536827,https://www.google.com/maps/place/?q=place_id:ChIJeeoDIQD5kT4R4X4uH5l9hQs,https://www.google.com/maps/place/?q=place_id:ChIJeeoDIQD5kT4R4X4uH5l9hQs,,https://www.google.com/maps/place/?q=place_id:ChIJeeoDIQD5kT4R4X4uH5l9hQs,https://www.google.com/s2/favicons?domain=www.google.com&sz=128,https://maps.google.com/maps/api/staticmap?center=23.6015616%2C58.5368268&zoom=16&size=900x900&language=en&markers=23.6015616%2C58.5368268&sensor=false&client=google-maps-frontend&signature=aixfdkYdiVU_QDmj-DnVklSc_Tw,,,,,Moving and storage service,Moving and storage service,,,,,,,,,,,,,,,2025-10-04,,,,,,,,,,,,,,,,,,,,,,,,,,
ChIJJTSNZUD_kT4R1ua2_b_atd4,north-muscat-logistic-relocation,NORTH MUSCAT LOGISTIC - RELOCATION,Moving & Storage,,moving;relocation;storage;packers,,"Al Ghubrah Ash Shamaliyyah, Muscat 111, Oman",Muscat,Oman,23.588987,58.404225,https://www.google.com/maps/place/?q=place_id:ChIJJTSNZUD_kT4R1ua2_b_atd4,https://nmloman.com/,+968 7864 6556,https://nmloman.com/,https://www.google.com/s2/favicons?domain=nmloman.com&sz=128,https://nmloman.com/wp-content/uploads/2024/05/north-muscat-logo-01.png,,,,,"About Company North Muscat Transport & Service LLC Welcome to North Muscat Transport & Service LLC, we are committed to delivering exceptional logistics solutions tailored to your business needs.…","About Company North Muscat Transport & Service LLC Welcome to North Muscat Transport & Service LLC, we are committed to delivering exceptional logistics solutions tailored to your business needs. Located in the heart of Oman, our services are designed to connect businesses across the Sultanate and beyond with efficiency and reliability. Read More + Years North Muscat Logistics, we connect Oman and the world with seamless logistics services you can trust.",,,packing;storage;international moving;local moving;customs clearance,,,5.00,,,,,,7,Google,,2025-10-04,,,,,,,,https://nmloman.com/contact,,,,Yes,,Yes,Yes,Yes,,,,,,Yes,,,,
ChIJSyMY8Sv_kT4RuFYScyQ7OkM,najoom-pack-and-movers,Najoom Pack and Movers,Moving & Storage,,moving;relocation;storage;packers,,"Ghubra Roundabout Ghubra ghubrah OM, مسقط 133, Oman",Muscat,Oman,23.588782,58.407982,https://www.google.com/maps/place/?q=place_id:ChIJSyMY8Sv_kT4RuFYScyQ7OkM,https://najoommovers.com/,+968 9250 8377,https://najoommovers.com/,https://www.google.com/s2/favicons?domain=najoommovers.com&sz=128,https://najoommovers.com/upload/banner/1_banner.jpg,,,,,Moving in Oman? Struggling with heavy furniture? Our experienced movers lift the stress & furniture! Free quotes. Contact us!,"Moving in Oman? Struggling with heavy furniture? Our experienced movers lift the stress & furniture! Free quotes. Contact us! Reliable Moving Services in Oman | Your Stress-Free Relocation Partner Moving to a new home, office, or even another country can feel like tackling a mountain of tasks. Here at Najoom Movers, we understand the mix of emotions and logistics involved, and we're here to turn your relocation into a breeze. As a trusted moving company across...",,,storage,,,5.00,,,,,,2,Google,,2025-10-04,,,,,,,,https://najoommovers.com/quote,,,,,,Yes,,,,,,,,,,,,
ChIJH6KPwy75kT4RM1054RQKMfg,oman-movers,Oman Movers,Moving & Storage,,moving;relocation;storage;packers,,"4185 way, Ruwi St, مسقط 112, Oman",Muscat,Oman,23.586660,58.540644,https://www.google.com/maps/place/?q=place_id:ChIJH6KPwy75kT4RM1054RQKMfg,https://www.google.com/maps/place/?q=place_id:ChIJH6KPwy75kT4RM1054RQKMfg,+968 9693 2626,https://www.google.com/maps/place/?q=place_id:ChIJH6KPwy75kT4RM1054RQKMfg,https://www.google.com/s2/favicons?domain=www.google.com&sz=128,https://streetviewpixels-pa.googleapis.com/v1/thumbnail?panoid=I7xCI6PnuhaDEHNk3ypSAQ&cb_client=search.gws-prod.gps&w=900&h=900&yaw=151.08916&pitch=0&thumbfov=100,,,,,★★★★★ · Moving and storage service,★★★★★ · Moving and storage service,,,,,,5.00,,,,,,7,Google,,2025-10-04,,,,,,,,,,,,,,,,,,,,,,,,,,
ChIJU4807Zn_kT4RqbW7dcowZXg,oman-movers-and-packer,Oman Movers and Packer,Moving & Storage,,moving;relocation;storage;packers,,"LuLu Regional Office, Y Tower, Al Khwair muscat OM Al Khwair OM, مسقط 436, Oman",Muscat,Oman,23.595949,58.419248,https://www.google.com/maps/place/?q=place_id:ChIJU4807Zn_kT4RqbW7dcowZXg,http://omanmoversandpacker.com/,+968 9435 6510,http://omanmoversandpacker.com/,https://www.google.com/s2/favicons?domain=omanmoversandpacker.com&sz=128,https://omanmoversandpacker.com/wp-content/uploads/2024/09/Menu-Logo.png,,,,,Need reliable packers and movers in Muscat? Our Oman movers offer seamless relocation services tailored to your needs. Request a quote today!,"Need reliable packers and movers in Muscat? Our Oman movers offer seamless relocation services tailored to your needs. Request a quote today! Looking for a hassle-free relocation service that puts your peace of mind first? Oman Packers and Movers is your trusted partner for seamless, stress-free moves. With over 10 years of experience, we provide comprehensive packing and moving services that cover everything from household packing and office relocations to international shipping and automobile transport. Whether you’re moving from Oman to cities like Adam, Nizwa, or Sohar or relocating…",,,packing;storage;international moving;office moving;heavy lift;boxes & supplies,,,4.60,,,,,,47,Google,,2025-10-04,,,,,,,,https://omanmoversandpacker.com/get-a-quote/,,https://www.gps.ie/,,Yes,,Yes,Yes,,Yes,,,,,,Yes,Yes,,
ChIJX4pOFS7_kT4RkWWLpKBICCY,oman-house-shifting,Oman house shifting,Moving & Storage,,moving;relocation;storage;packers,,"19 2, شارع الخوير، مسقط 568, Oman",Muscat,Oman,23.596801,58.434033,https://www.google.com/maps/place/?q=place_id:ChIJX4pOFS7_kT4RkWWLpKBICCY,http://muscatshifting.com/,+968 9250 1348,http://muscatshifting.com/,https://www.google.com/s2/favicons?domain=muscatshifting.com&sz=128,https://www.omanobserver.om/omanobserver/uploads/images/2025/04/02/2969730.jpeg,,,,,,,,,,,,4.90,,,,,,27,Google,,2025-10-04,,,,,,,,,,,,,,,,,,,,,,,,,,
ChIJRWiEwh79jT4Rh5I5cfVKJL8,packing-and-moving,Packing and Moving,Moving & Storage,,moving;relocation;storage;packers,,"Muscat OM, السيب‎ 112, Oman",Muscat,Oman,23.632678,58.188044,https://www.google.com/maps/place/?q=place_id:ChIJRWiEwh79jT4Rh5I5cfVKJL8,https://www.google.com/maps/place/?q=place_id:ChIJRWiEwh79jT4Rh5I5cfVKJL8,+968 9572 8881,https://www.google.com/maps/place/?q=place_id:ChIJRWiEwh79jT4Rh5I5cfVKJL8,https://www.google.com/s2/favicons?domain=www.google.com&sz=128,https://maps.google.com/maps/api/staticmap?center=23.6326784%2C58.1880435&zoom=16&size=900x900&language=en&markers=23.6326784%2C58.1880435&sensor=false&client=google-maps-frontend&signature=nxE2mvSLiywDHENBDWYmuEcE2Fk,,,,,★★★★★ · Mover,★★★★★ · Mover,,,,,,5.00,,,,,,1,Google,,2025-10-04,,,,,,,,,,,,,,,,,,,,,,,,,,
ChIJfe-wjCPnjT4RJU9PVmkgZF0,professional-moving-solutions,Professional Moving Solutions,Moving & Storage,,moving;relocation;storage;packers,,"M32W+Q8C, Seeb, Oman",Muscat,Oman,23.651937,58.095750,https://www.google.com/maps/place/?q=place_id:ChIJfe-wjCPnjT4RJU9PVmkgZF0,https://www.google.com/maps/place/?q=place_id:ChIJfe-wjCPnjT4RJU9PVmkgZF0,,https://www.google.com/maps/place/?q=place_id:ChIJfe-wjCPnjT4RJU9PVmkgZF0,https://www.google.com/s2/favicons?domain=www.google.com&sz=128,https://lh3.googleusercontent.com/gps-cs-s/AC9h4nqjROYHYSvt0Mw31oRXt5UBcaI_UruRNAOr85A-IC3KTE1wztB3JkyeY0n2sOkQMH0Q3GHxoK2tfbXILyOGXb138HG8m_gkmBAOEYBZdabn94sBHDQia9JuShS6TDYiJYNW74Q=w900-h900-p-k-no,,,,,★★★★★ · Moving and storage service,★★★★★ · Moving and storage service,,,,,,4.50,,,,,,11,Google,,2025-10-04,,,,,,,,,,,,,,,,,,,,,,,,,,
ChIJfaC95zX_kT4RuxMYnII6QEU,quick-mover-oman,Quick Mover Oman,Moving & Storage,,moving;relocation;storage;packers,,"Near AI Khuwair Market, Muscat 133, Oman",Muscat,Oman,23.596801,58.434033,https://www.google.com/maps/place/?q=place_id:ChIJfaC95zX_kT4RuxMYnII6QEU,https://quickmoveroman.com/,+968 9692 5777,https://quickmoveroman.com/,https://www.google.com/s2/favicons?domain=quickmoveroman.com&sz=128,https://quickmoveroman.com/wp-content/uploads/2025/07/Quick-mover-oman-logo-1.png,,,,,"QuickMoveRoman is your reliable partner for residential and commercial moves. With years of experience, our dedicated team provides expert packing, furniture","QuickMoveRoman is your reliable partner for residential and commercial moves. With years of experience, our dedicated team provides expert packing, furniture QuickMoveRoman is your reliable partner for residential and commercial moves. With years of experience, our dedicated team provides expert packing, furniture dismantling and reassembly, transportation, and storage solutions. Our goal? To deliver a stress-free moving experience that’s fast, safe, and tailored to your needs.",,,packing;unpacking;storage;international moving;local moving;office moving;residential moving;insurance;customs clearance;heavy lift,,,4.70,,,,,,21,Google,,2025-10-04,,,,,,,,,,,,Yes,Yes,Yes,Yes,Yes,Yes,Yes,,,Yes,Yes,Yes,,,
ChIJETvX4JD5kT4RHiFGA8yBNmM,qurm,Qurm,Moving & Storage,,moving;relocation;storage;packers,,"JF3C+HF, Muscat, Oman",Muscat,Oman,23.603907,58.471219,https://www.google.com/maps/place/?q=place_id:ChIJETvX4JD5kT4RHiFGA8yBNmM,https://www.google.com/maps/place/?q=place_id:ChIJETvX4JD5kT4RHiFGA8yBNmM,+968 9595 0368,https://www.google.com/maps/place/?q=place_id:ChIJETvX4JD5kT4RHiFGA8yBNmM,https://www.google.com/s2/favicons?domain=www.google.com&sz=128,https://lh3.googleusercontent.com/gps-cs-s/AC9h4nrSHiNEDYuShOlBUhL91kHisPwp7c6PXwggtyyWDreivJfXIaxHlEt7Ho2_zB3CTuM73OiYLoScI_PUDq3H_7iCzvgpp8Yqn8t8tT5tf8IQZTvSQkaQAcEgv7VADybPgGesNFVKuQ=w900-h900-p-k-no,,,,,★★★★★ · Mover,★★★★★ · Mover,,,,,,5.00,,,,,,2,Google,,2025-10-04,,,,,,,,,,,,,,,,,,,,,,,,,,
