id,slug,name,category,tagline,tags,neighborhood,address,city,country,lat,lng,maps_url,website,phone,url,logo_url,hero_url,image_credit,image_source_url,hours_raw,description,about_short,about_long,price_range,pricing,amenities,cuisines,meals,rating_overall,sub_food_quality,sub_service,sub_ambience,sub_value,sub_accessibility,review_count,review_source,review_insight,last_updated,services,coverage_area,truck_sizes,packing_materials,storage_available,insurance_offered,free_quote_url,quote_url,booking_url,tracking_url,brochure_url,packing,unpacking,storage,international_moving,local_moving,office_moving,residential_moving,vehicle_shipping,pet_relocation,insurance,customs_clearance,heavy_lift,boxes_supplies,approx_price_min,approx_price_max
ChIJt68xrWsBjj4RHC0-Z8iN3P0,ags-movers-oman,AGS Movers Oman,Moving & Storage,,moving;relocation;storage;packers,,"Warehouse #4, Way 5019, Muscat 100, Oman",Muscat,Oman,23.571454,58.371857,https://www.google.com/maps/place/?q=place_id:ChIJt68xrWsBjj4RHC0-Z8iN3P0,https://www.agsmovers.com/branches/middle-east/oman/oman/,+968 24 231699,https://www.agsmovers.com/branches/middle-east/oman/oman/,https://www.google.com/s2/favicons?domain=www.agsmovers.com&sz=128,https://www.agsmovers.com/wp-content/uploads/2017/12/ags-north-africa-middle-east-branch-3.jpg,,,,,"AGS Movers Oman offers professional local and international removals, packing, storage, vehicle moving, and insurance. Move to and from Muscat effortlessly.","AGS Movers Oman offers professional local and international removals, packing, storage, vehicle moving, and insurance. Move to and from Muscat effortlessly. Are you searching for a trusted moving company that serves the whole of Oman, including major cities like Muscat, Salalah, Sohar, Nizwa, Sur, and beyond? Based in the Oman, AGS Movers Oman is your dedicated international removals partner, offering specialised moving and storage services for individuals and businesses nationwide. With AGS Movers Oman, you can count on a professional and seamless move, no matter where your destination lies…",,,packing;unpacking;storage;international moving;local moving;vehicle shipping;insurance;customs clearance;boxes & supplies,,,4.90,,,,,,19,Google,,2025-10-04,,,,,,,,https://www.agsmovers.com/moving-quote/,,,,Yes,Yes,Yes,Yes,Yes,,,Yes,,Yes,Yes,,Yes,,
ChIJaxq-kDf_kT4RogLWUdtL6Vc,al-sarmi-transport,AL SARMI TRANSPORT,Moving & Storage,,moving;relocation;storage;packers,,"HCMF+993, Muscat, Oman",Muscat,Oman,23.583386,58.423429,https://www.google.com/maps/place/?q=place_id:ChIJaxq-kDf_kT4RogLWUdtL6Vc,https://www.google.com/maps/place/?q=place_id:ChIJaxq-kDf_kT4RogLWUdtL6Vc,+968 9989 9885,https://www.google.com/maps/place/?q=place_id:ChIJaxq-kDf_kT4RogLWUdtL6Vc,https://www.google.com/s2/favicons?domain=www.google.com&sz=128,https://lh3.googleusercontent.com/gps-cs-s/AC9h4noelhmK22XL-I8-KkJ_SJpjFQw56-IAV-Ab0G0NpuLUKa18bB7EvqmnwfZt7xfxumF92DJ2qEanfqjbGVzRtsa6pLhivYgcYsZpZKXUWHHO1qz8mLVVoe0UiIl4FrpUae9yhcWd=w900-h900-p-k-no,,,,,★★★★☆ · Mover,★★★★☆ · Mover,,,,,,3.90,,,,,,7,Google,,2025-10-04,,,,,,,,,,,,,,,,,,,,,,,,,,
ChIJjTGJO7n_kT4RzWBqivc1J_w,aus-movers-logistics,AUS Movers & Logistics,Moving & Storage,,moving;relocation;storage;packers,,"North Al-Ghubrah, Muscat 112, Oman",Muscat,Oman,23.574836,58.400958,https://www.google.com/maps/place/?q=place_id:ChIJjTGJO7n_kT4RzWBqivc1J_w,http://www.ausmoversoman.com/,+968 7713 0203,http://www.ausmoversoman.com/,https://www.google.com/s2/favicons?domain=www.ausmoversoman.com&sz=128,https://ausmoversoman.com/wp-content/uploads/2024/11/aus_logo.png,,,,,"AUS Movers & Logistics: Trusted experts in relocation, packing, and storage services in Oman. Reliable and affordable solutions for office and home moving.","AUS Movers & Logistics: Trusted experts in relocation, packing, and storage services in Oman. Reliable and affordable solutions for office and home moving. Premium Professional Movers for Residential, Commercial & International Moving Services",,,packing;unpacking;storage;international moving;local moving;office moving;residential moving;pet relocation;customs clearance;boxes & supplies,,,4.90,,,,,,50,Google,,2025-10-04,,,,,,,,https://ausmoversoman.com/,,,,Yes,Yes,Yes,Yes,Yes,Yes,Yes,,Yes,,Yes,,Yes,,
ChIJMRo7wzgBjj4RbCsFsUSWcVw,ali-moving-solutions-movers-and-shifting-services,Ali Moving Solutions (Movers and Shifting Services),Moving & Storage,,moving;relocation;storage;packers,,"Flat No. 105, Building No. 13, Al، Muscat, Oman",Muscat,Oman,23.584865,58.369791,https://www.google.com/maps/place/?q=place_id:ChIJMRo7wzgBjj4RbCsFsUSWcVw,https://www.google.com/maps/place/?q=place_id:ChIJMRo7wzgBjj4RbCsFsUSWcVw,+968 9670 6371,https://www.google.com/maps/place/?q=place_id:ChIJMRo7wzgBjj4RbCsFsUSWcVw,https://www.google.com/s2/favicons?domain=www.google.com&sz=128,https://lh3.googleusercontent.com/p/AF1QipOPlKDeaN4YdzyqT1V7uqQsGmPpUvko9kXNTxk6=w900-h900-p-k-no,,,,,★★★★★ · Mover,★★★★★ · Mover,,,,,,4.70,,,,,,3,Google,,2025-10-04,,,,,,,,,,,,,,,,,,,,,,,,,,
ChIJcdThoS7_kT4RYIck_5uuQlY,allied-logistics-llc,Allied Logistics LLC,Moving & Storage,,moving;relocation;storage;packers,,"Warehouse #4, Way 5019, Ghala Industrial Muscat OM, مسقط 100, Oman",Muscat,Oman,23.571761,58.372045,https://www.google.com/maps/place/?q=place_id:ChIJcdThoS7_kT4RYIck_5uuQlY,http://www.alliedlogistics.co.om/,+968 22 071177,http://www.alliedlogistics.co.om/,https://www.google.com/s2/favicons?domain=www.alliedlogistics.co.om&sz=128,https://www.omanobserver.om/omanobserver/uploads/images/2025/03/18/2958649.jpg,,,,,,,,,,,,3.90,,,,,,33,Google,,2025-10-04,,,,,,,,,,,,,,,,,,,,,,,,,,
ChIJRcaZLtFpXz4RI9M3N5bP-qU,allied-moving-services-uae,Allied Moving Services UAE,Moving & Storage,,moving;relocation;storage;packers,,"Boulevard Plaza Tower 1 - 9th Floor, Office - 22 Sheikh Mohammed bin Rashid Blvd - Burj Khalifa - Dubai - United Arab Emirates",Muscat,Oman,25.199986,55.275023,https://www.google.com/maps/place/?q=place_id:ChIJRcaZLtFpXz4RI9M3N5bP-qU,http://www.allied.com/ae?utm_source=google&utm_medium=organic&utm_campaign=GBP,+971 4 818 0400,http://www.allied.com/ae?utm_source=google&utm_medium=organic&utm_campaign=GBP,https://www.google.com/s2/favicons?domain=www.allied.com&sz=128,https://avlnavlblob.blob.core.windows.net/allied-com/images/librariesprovider2/default-album/uae-resize-home.jpg?sfvrsn=b80b49fb_6,,,,,"Whether moving overseas or domestically, our award winning team of packers & movers are professional, reliable & efficient. Contact us today!","Whether moving overseas or domestically, our award winning team of packers & movers are professional, reliable & efficient. Contact us today! Welcome to Allied Moving Services UAE, your partner in seamless and stress-free relocations. With a global legacy of excellence, we bring world-class moving expertise to the heart of the United Arab Emirates. Our team of dedicated movers and packers with years of experience navigating the intricacies of the UAE are committed to making your move a success down to every detail.",,,packing;unpacking;storage;international moving;local moving;office moving;pet relocation;insurance;boxes & supplies,,,3.70,,,,,,79,Google,,2025-10-04,,,,,,,,https://www.allied.com/ae/?utm_source=google&utm_medium=organic&utm_campaign=GBP#thankYouForm,,https://www.allied.com/ae/resources/track-your-move,,Yes,Yes,Yes,Yes,Yes,Yes,,,Yes,Yes,,,Yes,,
ChIJ39Hh54DaRT4RnlnzPij32xs,almas-movers-international-domestic-international-moving-company,Almas Movers International | Domestic & International Moving Company,Moving & Storage,,moving;relocation;storage;packers,,"Building 317, Office 01, Street 250, Zone 43, Fereej Al Ali, الدوحة، Qatar",Muscat,Oman,25.254097,51.512644,https://www.google.com/maps/place/?q=place_id:ChIJ39Hh54DaRT4RnlnzPij32xs,http://www.almasintl.com/,+974 4435 5663,http://www.almasintl.com/,https://www.google.com/s2/favicons?domain=www.almasintl.com&sz=128,https://www.omanobserver.om/omanobserver/uploads/images/2024/06/25/2701550.jpg,,,,,,,,,international moving,,,4.90,,,,,,1238,Google,,2025-10-04,,,,,,,,,,,,,,,Yes,,,,,,,,,,,
ChIJhYxdsYDdxUcR_BSDaXZmziI,atlas-international-movers-bv,Atlas International Movers BV,Moving & Storage,,moving;relocation;storage;packers,,"Bennebroekerweg 281, 1435 CJ Rijsenhout, Netherlands",Muscat,Oman,52.267545,4.698374,https://www.google.com/maps/place/?q=place_id:ChIJhYxdsYDdxUcR_BSDaXZmziI,http://www.atlas-movers.nl/,+31 297 348 281,http://www.atlas-movers.nl/,https://www.google.com/s2/favicons?domain=www.atlas-movers.nl&sz=128,https://atlas-movers.com/wp-content/uploads/2022/12/Atlas-movers-7.png,,,,,Atlas International Movers provides international moving services. ✔️Many years of experience ✔️ Worldwide network of trusted partners,"Atlas International Movers provides international moving services. ✔️Many years of experience ✔️ Worldwide network of trusted partners Tell us where you are moving to, we will get you there safely and swiftly",,,storage;international moving;office moving,,,4.00,,,,,,89,Google,,2025-10-04,,,,,,,,https://atlas-movers.com/quotation/,https://atlas-movers.com/wp-content/uploads/2025/01/AVVV-AVVV-BE-AVBV-AVHD-PV05-Terms-and-Conditions-2025.pdf,https://atlas-movers.com/wp-content/uploads/2025/01/AVVV-AVVV-BE-AVBV-AVHD-PV05-Terms-and-Conditions-2025.pdf,https://atlas-movers.com/wp-content/uploads/2025/01/AVVV-AVVV-BE-AVBV-AVHD-PV05-Terms-and-Conditions-2025.pdf,,,Yes,Yes,,Yes,,,,,,,,,
ChIJzUtZyV75kT4RKAWwylEChBw,best-movers,Best Movers,Moving & Storage,,moving;relocation;storage;packers,,"Ruwi Building Number 2411, Road 4535, Muscat 417, Oman",Muscat,Oman,23.587414,58.543193,https://www.google.com/maps/place/?q=place_id:ChIJzUtZyV75kT4RKAWwylEChBw,https://www.google.com/maps/place/?q=place_id:ChIJzUtZyV75kT4RKAWwylEChBw,+968 7981 3112,https://www.google.com/maps/place/?q=place_id:ChIJzUtZyV75kT4RKAWwylEChBw,https://www.google.com/s2/favicons?domain=www.google.com&sz=128,https://lh3.googleusercontent.com/p/AF1QipMFnsfwFJZMnKzziUSW6lVDF4g3NXTsGm5THo5a=w900-h900-p-k-no,,,,,★★★★★ · Mover,★★★★★ · Mover,,,,,,5.00,,,,,,3,Google,,2025-10-04,,,,,,,,,,,,,,,,,,,,,,,,,,
ChIJ4Q04QvhDXz4Rt5w_uDoqThE,best-movers-and-packers-dubai,Best Movers and Packers Dubai,Moving & Storage,,moving;relocation;storage;packers,,"Business Bay, Prism Tower - Office # 702 Al Mustaqbal St - Zaa'beel Second - Za'abeel 2 - Dubai - United Arab Emirates",Muscat,Oman,25.206215,55.278928,https://www.google.com/maps/place/?q=place_id:ChIJ4Q04QvhDXz4Rt5w_uDoqThE,https://www.topbestmovers.com/,+971 50 951 9430,https://www.topbestmovers.com/,https://www.google.com/s2/favicons?domain=www.topbestmovers.com&sz=128,https://moverz.themeht.com/wp-content/uploads/2024/10/get4.9d737c55f921f22aafb6.png,,,,,Dubai MoversFast Movers and Packers We Make Moving Cheap & Safe. Experience hassle-free journeys with our movers and packers solutions that prioritize your comfort. Get A Quote Watch Now Local…,"Dubai MoversFast Movers and Packers We Make Moving Cheap & Safe. Experience hassle-free journeys with our movers and packers solutions that prioritize your comfort. Get A Quote Watch Now Local MoversAffordable Movers and Packers Careful MovesMade Easy. Office Relocation, Removal Services, Exhibitions Events, Storage Services in Dubai, UAE. Get A Quote Watch Now Moving Safely […] Experience hassle-free journeys with our movers and packers solutions that prioritize your comfort.",,,packing;storage;international moving;local moving;office moving;residential moving;insurance,,,4.90,,,,,,194,Google,,2025-10-04,,,,,,,,https://www.topbestmovers.com/contact,,,,Yes,,Yes,Yes,Yes,Yes,Yes,,,Yes,,,,,
ChIJeRLkShD5kT4Rb05M_zFHqVY,bestmoversoman,Bestmoversoman,Moving & Storage,,moving;relocation;storage;packers,,"1122 RUWI OM, Muscat 114, Oman",Muscat,Oman,23.597531,58.540170,https://www.google.com/maps/place/?q=place_id:ChIJeRLkShD5kT4Rb05M_zFHqVY,https://www.bestmoversoman.com/,+968 9741 2541,https://www.bestmoversoman.com/,https://www.google.com/s2/favicons?domain=www.bestmoversoman.com&sz=128,https://bestmoversoman.com/wp-content/uploads/2025/07/Banner-01.jpg,,,,,,"Best Packers & Movers Oman is a trusted name in the logistics and relocation industry, proudly serving individuals and businesses across Oman with reliable, efficient, and tailored moving solutions. With a strong reputation built on years of experience, our company has become synonymous with professionalism, safety, and customer satisfaction. We specialize in a wide range of services including residential and office relocation, local and international shipping, vehicle transport, secure storage solutions, and comprehensive packing and unpacking services.",,,packing;unpacking;storage;international moving;office moving;customs clearance;boxes & supplies,,,4.40,,,,,,7,Google,,2025-10-04,,,,,,,,,,,,Yes,Yes,Yes,Yes,,Yes,,,,,Yes,,Yes,,
ChIJUe9BM2T_kT4RT5ZV0xhYq0k,bhatti-mover-oman,Bhatti Mover Oman,Moving & Storage,,moving;relocation;storage;packers,,"Sultan Qaboos St, Muscat 130, Oman",Muscat,Oman,23.590667,58.410834,https://www.google.com/maps/place/?q=place_id:ChIJUe9BM2T_kT4RT5ZV0xhYq0k,https://bhattimoveroman.com/,+968 7909 2634,https://bhattimoveroman.com/,https://www.google.com/s2/favicons?domain=bhattimoveroman.com&sz=128,https://bhattimoveroman.com/wp-content/uploads/2025/07/Bhatti-Movers-e1751718836169.png,,,,,We Make Moving Fast & EasyCheap & Safe,"We Make Moving Fast & EasyCheap & Safe From packing your memories to placing your future, Bhatti Movers turns moving into a breeze. Whether it’s local or international—we handle it all, so you don’t have to.",,,packing;unpacking;storage;international moving;local moving;office moving;residential moving;vehicle shipping;boxes & supplies,,,5.00,,,,,,3,Google,,2025-10-04,,,,,,,,,,,,Yes,Yes,Yes,Yes,Yes,Yes,Yes,Yes,,,,,Yes,,
ChIJ-QqdNgD5kT4Ri2sQjiv-R3Q,billamovers,Billamovers,Moving & Storage,,moving;relocation;storage;packers,,"HGQV+PWP, Ruwi St, Muscat, Oman",Muscat,Oman,23.589350,58.544843,https://www.google.com/maps/place/?q=place_id:ChIJ-QqdNgD5kT4Ri2sQjiv-R3Q,https://www.google.com/maps/place/?q=place_id:ChIJ-QqdNgD5kT4Ri2sQjiv-R3Q,,https://www.google.com/maps/place/?q=place_id:ChIJ-QqdNgD5kT4Ri2sQjiv-R3Q,https://www.google.com/s2/favicons?domain=www.google.com&sz=128,https://streetviewpixels-pa.googleapis.com/v1/thumbnail?panoid=YCw-5nZgbp2P8zC1-s_E5w&cb_client=search.gws-prod.gps&w=900&h=900&yaw=192.73062&pitch=0&thumbfov=100,,,,,Moving and storage service,Moving and storage service,,,,,,,,,,,,,,,2025-10-04,,,,,,,,,,,,,,,,,,,,,,,,,,
ChIJj2hQAaFpXz4RxinIYwG7sHs,brightlink-cargo-and-movers-llc,BrightLink Cargo and Movers LLC,Moving & Storage,,moving;relocation;storage;packers,,Al Asayel St - Business Bay - Dubai - United Arab Emirates,Muscat,Oman,25.187331,55.280591,https://www.google.com/maps/place/?q=place_id:ChIJj2hQAaFpXz4RxinIYwG7sHs,https://www.brightlinkcargo.com/,+971 50 424 6869,https://www.brightlinkcargo.com/,https://www.google.com/s2/favicons?domain=www.brightlinkcargo.com&sz=128,https://www.brightlinkcargo.com/wp-content/uploads/2024/09/logistics-services-company-home-img.webp,,,,,"BrightLink Shipping and Logistics offers shipping, logistics, freight forwarding, customs clearance, warehousing, and moving services in UAE.","BrightLink Shipping and Logistics offers shipping, logistics, freight forwarding, customs clearance, warehousing, and moving services in UAE. Efficient Freight Forwarding, Moving, Storage, and Cargo Solutions with a Global Reach: BrightLink Shipping and Logistics, Your Trusted Logistics Partner in UAE.",,,packing;storage;international moving;local moving;office moving;vehicle shipping;customs clearance;boxes & supplies,,,5.00,,,,,,29,Google,,2025-10-04,,,,,,,,https://www.brightlinkcargo.com/shipping-quote/,,https://www.brightlinkcargo.com/shipment-tracking/,,Yes,,Yes,Yes,Yes,Yes,,Yes,,,Yes,,Yes,,
ChIJFzFsDotDXz4RmYS3oi0peXM,brightlink-cargo-and-movers-llc,BrightLink Cargo and Movers LLC,Moving & Storage,,moving;relocation;storage;packers,,7 Street - Ras Al Khor Industrial Area - Ras Al Khor Industrial Area 2 - Dubai - United Arab Emirates,Muscat,Oman,25.182370,55.354230,https://www.google.com/maps/place/?q=place_id:ChIJFzFsDotDXz4RmYS3oi0peXM,https://www.brightlinkcargo.com/,+971 50 643 6869,https://www.brightlinkcargo.com/,https://www.google.com/s2/favicons?domain=www.brightlinkcargo.com&sz=128,https://www.brightlinkcargo.com/wp-content/uploads/2024/09/logistics-services-company-home-img.webp,,,,,"BrightLink Shipping and Logistics offers shipping, logistics, freight forwarding, customs clearance, warehousing, and moving services in UAE.","BrightLink Shipping and Logistics offers shipping, logistics, freight forwarding, customs clearance, warehousing, and moving services in UAE. Efficient Freight Forwarding, Moving, Storage, and Cargo Solutions with a Global Reach: BrightLink Shipping and Logistics, Your Trusted Logistics Partner in UAE.",,,packing;storage;international moving;local moving;office moving;vehicle shipping;customs clearance;boxes & supplies,,,5.00,,,,,,5,Google,,2025-10-04,,,,,,,,https://www.brightlinkcargo.com/shipping-quote/,,https://www.brightlinkcargo.com/shipment-tracking/,,Yes,,Yes,Yes,Yes,Yes,,Yes,,,Yes,,Yes,,
ChIJydvLqwn9jT4RmAqoLlbUKGw,brightlink-shipping-and-logistics,BrightLink Shipping and Logistics,Moving & Storage,,moving;relocation;storage;packers,,"Al Seeb Street Al Seeb, مسقط، Oman",Muscat,Oman,23.648002,58.216423,https://www.google.com/maps/place/?q=place_id:ChIJydvLqwn9jT4RmAqoLlbUKGw,https://www.brightlinkcargo.com/en-om/,+968 7277 7405,https://www.brightlinkcargo.com/en-om/,https://www.google.com/s2/favicons?domain=www.brightlinkcargo.com&sz=128,https://www.brightlinkcargo.com/en-om/wp-content/uploads/sites/2/2024/09/logistics-services-company-home-img.webp,,,,,"BrightLink Shipping and Logistics offers shipping, logistics, freight forwarding, customs clearance, warehousing, and moving services in Oman.","BrightLink Shipping and Logistics offers shipping, logistics, freight forwarding, customs clearance, warehousing, and moving services in Oman. Innovative Freight Forwarding Solutions with Global Expertise: BrightLink Shipping and Logistics, Your Premier Logistics Partner in Oman",,,packing;storage;international moving;local moving;office moving;vehicle shipping;customs clearance;boxes & supplies,,,3.80,,,,,,10,Google,,2025-10-04,,,,,,,,https://www.brightlinkcargo.com/en-om/shipping-quote/,,https://www.brightlinkcargo.com/en-om/shipment-tracking/,,Yes,,Yes,Yes,Yes,Yes,,Yes,,,Yes,,Yes,,
ChIJd3Uol9RrXz4R6x7KPvkv9Zw,easytruck-moving-storage-shipping,"Easytruck Moving, Storage & Shipping.",Moving & Storage,,moving;relocation;storage;packers,,87b 6 Street - Al Quoz - Dubai - United Arab Emirates,Muscat,Oman,25.139402,55.221609,https://www.google.com/maps/place/?q=place_id:ChIJd3Uol9RrXz4R6x7KPvkv9Zw,https://easytruck.ae/,+971 800 3279,https://easytruck.ae/,https://www.google.com/s2/favicons?domain=easytruck.ae&sz=128,https://easytruck.ae/wp-content/uploads/2022/08/Home-Banner-1200x617.png,,,,,"Easytruck™ award-winning Storage and moving companies in Dubai and Abu Dhabi with a focus on customer service. We dismantle, pack, transport & store - you relax!","Easytruck™ award-winning Storage and moving companies in Dubai and Abu Dhabi with a focus on customer service. We dismantle, pack, transport & store - you relax! Book your Dubai movers or Abu Dhabi movers online or get in touch via live chat, Whatsapp, phone or webform.",,,packing;unpacking;storage;international moving;local moving;office moving;customs clearance;boxes & supplies,,,4.90,,,,,,542,Google,,2025-10-04,,,,,,,,https://easytruck.ae/booking/,https://easytruck.ae/booking/,,,Yes,Yes,Yes,Yes,Yes,Yes,,,,,Yes,,Yes,,
ChIJ-8sYqLf_kT4RZmSg0HMdDdk,etihad-mover-oman,Etihad Mover Oman,Moving & Storage,,moving;relocation;storage;packers,,"Coral Building, 2nd Floor, Al Khuwair Muscat 133, مسقط 112, Oman",Muscat,Oman,23.594733,58.442574,https://www.google.com/maps/place/?q=place_id:ChIJ-8sYqLf_kT4RZmSg0HMdDdk,https://etihadmoveroman.com/,+968 9595 5481,https://etihadmoveroman.com/,https://www.google.com/s2/favicons?domain=etihadmoveroman.com&sz=128,https://www.omanobserver.om/omanobserver/uploads/images/2025/05/11/3009009.jpeg,,,,,,,,,,,,4.80,,,,,,10,Google,,2025-10-04,,,,,,,,,,,,,,,,,,,,,,,,,,
ChIJA0vk9Of_kT4R26RD9PayhiA,gac-international-moving,GAC International Moving,Moving & Storage,,moving;relocation;storage;packers,,"Dauhat Al Adab St, Muscat, Oman",Muscat,Oman,23.592830,58.444355,https://www.google.com/maps/place/?q=place_id:ChIJA0vk9Of_kT4R26RD9PayhiA,https://moving.gac.com/,+968 24 477800,https://moving.gac.com/,https://www.google.com/s2/favicons?domain=moving.gac.com&sz=128,https://cdn2.hubspot.net/hubfs/3816325/SETTING%20UP%20200x222px.png,,,,,"With over 60 years of experience, GAC International Moving is a trusted provider of moving and packing services across Dubai, Abu Dhabi, Qatar, Kuwait, Bahrain, Oman, and Saudi Arabia. Offering…","With over 60 years of experience, GAC International Moving is a trusted provider of moving and packing services across Dubai, Abu Dhabi, Qatar, Kuwait, Bahrain, Oman, and Saudi Arabia. Offering reliable domestic and international relocation solutions for individuals and businesses. Learn more on our website. We understand that moving to a new house isn't just about moving furniture - it’s about relocating your home and preserving cherished memories while creating new ones. That’s why our expert team of packers and movers treats your belongings with the utmost care and attention, ensuring they…",,,packing;storage;international moving;local moving;office moving,,,4.80,,,,,,14,Google,,2025-10-04,,,,,,,,https://moving.gac.com/#form-pop,,,,Yes,,Yes,Yes,Yes,Yes,,,,,,,,,
ChIJ85ztjjIBjj4RkLdG1w3zBM0,happy-movers-logistics,Happy Movers Logistics,Moving & Storage,,moving;relocation;storage;packers,,"18th November St, Muscat 130, Oman",Muscat,Oman,23.600345,58.378613,https://www.google.com/maps/place/?q=place_id:ChIJ85ztjjIBjj4RkLdG1w3zBM0,https://happymovermsct.com/,+968 9579 7617,https://happymovermsct.com/,https://www.google.com/s2/favicons?domain=happymovermsct.com&sz=128,https://happymovermsct.com/admin/uploads/Dark-Logo-15-08-2024-1723708424-Happy-Mover.png,,,,,Looking for the best movers and packers in Oman? Trust Happy Mover MSC for a stress-free and reliable moving experience. We make relocation simple for you!,"Looking for the best movers and packers in Oman? Trust Happy Mover MSC for a stress-free and reliable moving experience. We make relocation simple for you! Are you planning to change the home and office location? Are you looking for the best movers and packers in Oman for shifting your home or office? If yes, then you should go for a trusted and reliable company. Happy Mover is going to provide the perfect moving solution to you. We are one of the leading best packers and movers in Oman and for the safe, secure, and careful home and office moving services.",,,packing;unpacking;storage;international moving;local moving;office moving;residential moving,,,4.70,,,,,,29,Google,,2025-10-04,,,,,,,,https://happymovermsct.com/,,,,Yes,Yes,Yes,Yes,Yes,Yes,Yes,,,,,,,,
ChIJNTcqcZ75kT4RlIJGOQ4jIEM,home-shifting-muscat-movers,Home Shifting Muscat Movers,Moving & Storage,,moving;relocation;storage;packers,,"HGQX+MQJ, 4308 Way, Muscat, Oman",Muscat,Oman,23.589177,58.549414,https://www.google.com/maps/place/?q=place_id:ChIJNTcqcZ75kT4RlIJGOQ4jIEM,http://muscatshifting.com/,+968 9729 6647,http://muscatshifting.com/,https://www.google.com/s2/favicons?domain=muscatshifting.com&sz=128,https://www.omanobserver.om/omanobserver/uploads/images/2024/06/25/2701550.jpg,,,,,,,,,,,,5.00,,,,,,37,Google,,2025-10-04,,,,,,,,,,,,,,,,,,,,,,,,,,
ChIJDxmjOPTSQmwRUDTHBxFHR1c,horizon-al-khoudh-united-llc,Horizon Al Khoudh United LLC,Moving & Storage,,moving;relocation;storage;packers,,"Misfah Industrial Area Near Sultan Centre Warehouse, Muscat 112, Oman",Muscat,Oman,23.493663,58.259601,https://www.google.com/maps/place/?q=place_id:ChIJDxmjOPTSQmwRUDTHBxFHR1c,https://horizon-united.com/,+968 9988 2613,https://horizon-united.com/,https://www.google.com/s2/favicons?domain=horizon-united.com&sz=128,https://www.omanobserver.om/omanobserver/uploads/images/2024/06/25/2701550.jpg,,,,,,,,,,,,5.00,,,,,,1,Google,,2025-10-04,,,,,,,,,,,,,,,,,,,,,,,,,,
ChIJiYGC1-8XHxURS5O08YY_fRQ,i-movers-relocation-services-sarl,I-MOVERS RELOCATION SERVICES SARL,Moving & Storage,,moving;relocation;storage;packers,,"Karam Rahal Street Bldg Achrafieh 4883, 2nd Floor, بيروت، Lebanon",Muscat,Oman,33.877660,35.521480,https://www.google.com/maps/place/?q=place_id:ChIJiYGC1-8XHxURS5O08YY_fRQ,https://www.i-movers.com/,+961 76 507 772,https://www.i-movers.com/,https://www.google.com/s2/favicons?domain=www.i-movers.com&sz=128,https://i-movers.com/wp-content/uploads/2020/03/Untitled-1-1_edited-e1675327313284.png,,,,,,"i-movers is an international certified moving company that is fully insured, completely transparent, and provides tailored services to your specific needs.",,,packing;unpacking;storage;international moving;local moving;office moving;vehicle shipping;insurance,,,4.90,,,,,,64,Google,,2025-10-04,,,,,,,,https://i-movers.com/request-a-quote/,,,,Yes,Yes,Yes,Yes,Yes,Yes,,Yes,,Yes,,,,,
